[
  {
    "id": "auto-apply-1762528550164-w81k9f4qs",
    "userId": "guest",
    "status": "active",
    "preferences": {
      "minMatchScore": 40,
      "locations": [],
      "jobTypes": [
        "full-time"
      ],
      "excludeCompanies": [],
      "maxApplicationsPerDay": 10,
      "autoWithdrawAfterDays": null
    },
    "cvData": {
      "fileName": "Maanda_Netshisumbewa_CV_.pdf",
      "uploadDate": "2025-11-07T15:15:46.877Z",
      "skills": [
        "javascript",
        "js",
        "python",
        "react",
        "node",
        "html",
        "css",
        "docker",
        "git",
        "agile",
        "excel",
        "microsoft office",
        "project management",
        "communication",
        "leadership",
        "management",
        "teamwork",
        "problem solving",
        "time management",
        "software development",
        "coding",
        "professional experience",
        "work ethic"
      ],
      "experience": {
        "years": 5,
        "roles": [
          "developer"
        ]
      },
      "education": [
        "degree",
        "bachelor"
      ],
      "keywords": [
        "skills",
        "react",
        "javascript",
        "node",
        "problem",
        "solving",
        "communication",
        "management",
        "2020",
        "2025",
        "curriculum",
        "vitae",
        "professional",
        "experience",
        "software",
        "developer",
        "tech",
        "company",
        "developed",
        "web",
        "applications",
        "using",
        "worked",
        "teams",
        "agile",
        "projects",
        "strong",
        "programming",
        "python",
        "html",
        "css",
        "tools",
        "git",
        "docker",
        "code"
      ],
      "summary": "\n      CURRICULUM VITAE\n      \n      PROFESSIONAL EXPERIENCE\n      Software Developer - Tech Company (2020-2025)\n      - Developed web applications using React, JavaScript, and Node.js\n      - Worked with teams on agile projects\n      - Strong problem-solving and communication skills\n      \n      SKILLS\n      Programming: JavaScript, Python, React, Node.js, HTML, CSS\n      Tools: Git, Docker, VS Code\n      Soft Skills: Communication, Leadership, Teamwork, Project Management\n      \n      EDUCATION\n      Bachelor's Degree in Computer Science\n      \n      Additional Skills: Microsoft Office, Excel, Problem Solving, Time Management\n    "
    },
    "statistics": {
      "totalApplications": 0,
      "pendingApplications": 0,
      "successfulApplications": 0,
      "failedApplications": 0,
      "startDate": "2025-11-07T15:15:50.165Z"
    },
    "createdAt": "2025-11-07T15:15:50.165Z"
  },
  {
    "id": "auto-apply-1762528560804-mf31fcehz",
    "userId": "guest",
    "status": "active",
    "preferences": {
      "minMatchScore": 40,
      "locations": [],
      "jobTypes": [
        "full-time",
        "part-time",
        "temporary",
        "contract"
      ],
      "excludeCompanies": [],
      "maxApplicationsPerDay": 10,
      "autoWithdrawAfterDays": null
    },
    "cvData": {
      "fileName": "Maanda_Netshisumbewa_CV_.pdf",
      "uploadDate": "2025-11-07T15:15:46.877Z",
      "skills": [
        "javascript",
        "js",
        "python",
        "react",
        "node",
        "html",
        "css",
        "docker",
        "git",
        "agile",
        "excel",
        "microsoft office",
        "project management",
        "communication",
        "leadership",
        "management",
        "teamwork",
        "problem solving",
        "time management",
        "software development",
        "coding",
        "professional experience",
        "work ethic"
      ],
      "experience": {
        "years": 5,
        "roles": [
          "developer"
        ]
      },
      "education": [
        "degree",
        "bachelor"
      ],
      "keywords": [
        "skills",
        "react",
        "javascript",
        "node",
        "problem",
        "solving",
        "communication",
        "management",
        "2020",
        "2025",
        "curriculum",
        "vitae",
        "professional",
        "experience",
        "software",
        "developer",
        "tech",
        "company",
        "developed",
        "web",
        "applications",
        "using",
        "worked",
        "teams",
        "agile",
        "projects",
        "strong",
        "programming",
        "python",
        "html",
        "css",
        "tools",
        "git",
        "docker",
        "code"
      ],
      "summary": "\n      CURRICULUM VITAE\n      \n      PROFESSIONAL EXPERIENCE\n      Software Developer - Tech Company (2020-2025)\n      - Developed web applications using React, JavaScript, and Node.js\n      - Worked with teams on agile projects\n      - Strong problem-solving and communication skills\n      \n      SKILLS\n      Programming: JavaScript, Python, React, Node.js, HTML, CSS\n      Tools: Git, Docker, VS Code\n      Soft Skills: Communication, Leadership, Teamwork, Project Management\n      \n      EDUCATION\n      Bachelor's Degree in Computer Science\n      \n      Additional Skills: Microsoft Office, Excel, Problem Solving, Time Management\n    "
    },
    "statistics": {
      "totalApplications": 0,
      "pendingApplications": 0,
      "successfulApplications": 0,
      "failedApplications": 0,
      "startDate": "2025-11-07T15:16:00.804Z"
    },
    "createdAt": "2025-11-07T15:16:00.804Z"
  },
  {
    "id": "auto-apply-1762632583467-iumyfopi0",
    "userId": "guest",
    "status": "active",
    "preferences": {
      "minMatchScore": 40,
      "locations": [],
      "jobTypes": [
        "full-time",
        "part-time",
        "temporary",
        "contract"
      ],
      "excludeCompanies": [],
      "maxApplicationsPerDay": 10,
      "autoWithdrawAfterDays": null
    },
    "cvData": {
      "fileName": "Maanda_Netshisumbewa_CV_.pdf",
      "uploadDate": "2025-11-08T20:09:41.107Z",
      "skills": [
        "javascript",
        "js",
        "python",
        "react",
        "node",
        "html",
        "css",
        "docker",
        "git",
        "agile",
        "excel",
        "microsoft office",
        "project management",
        "communication",
        "leadership",
        "management",
        "teamwork",
        "problem solving",
        "time management",
        "software development",
        "coding",
        "professional experience",
        "work ethic"
      ],
      "experience": {
        "years": 5,
        "roles": [
          "developer"
        ]
      },
      "education": [
        "degree",
        "bachelor"
      ],
      "keywords": [
        "skills",
        "react",
        "javascript",
        "node",
        "problem",
        "solving",
        "communication",
        "management",
        "2020",
        "2025",
        "curriculum",
        "vitae",
        "professional",
        "experience",
        "software",
        "developer",
        "tech",
        "company",
        "developed",
        "web",
        "applications",
        "using",
        "worked",
        "teams",
        "agile",
        "projects",
        "strong",
        "programming",
        "python",
        "html",
        "css",
        "tools",
        "git",
        "docker",
        "code"
      ],
      "desiredRoles": [
        "developer"
      ],
      "summary": "\n      CURRICULUM VITAE\n      \n      PROFESSIONAL EXPERIENCE\n      Software Developer - Tech Company (2020-2025)\n      - Developed web applications using React, JavaScript, and Node.js\n      - Worked with teams on agile projects\n      - Strong problem-solving and communication skills\n      \n      SKILLS\n      Programming: JavaScript, Python, React, Node.js, HTML, CSS\n      Tools: Git, Docker, VS Code\n      Soft Skills: Communication, Leadership, Teamwork, Project Management\n      \n      EDUCATION\n      Bachelor's Degree in Computer Science\n      \n      Additional Skills: Microsoft Office, Excel, Problem Solving, Time Management\n    "
    },
    "statistics": {
      "totalApplications": 0,
      "pendingApplications": 0,
      "successfulApplications": 0,
      "failedApplications": 0,
      "startDate": "2025-11-08T20:09:43.467Z"
    },
    "createdAt": "2025-11-08T20:09:43.467Z"
  },
  {
    "id": "auto-apply-1762632701438-9cr9kjjnc",
    "userId": "guest",
    "status": "active",
    "preferences": {
      "minMatchScore": 40,
      "locations": [],
      "jobTypes": [
        "full-time",
        "part-time",
        "temporary",
        "contract"
      ],
      "excludeCompanies": [],
      "maxApplicationsPerDay": 10,
      "autoWithdrawAfterDays": null
    },
    "cvData": {
      "fileName": "Maanda_Netshisumbewa_CV_.pdf",
      "uploadDate": "2025-11-08T20:09:41.107Z",
      "skills": [
        "javascript",
        "js",
        "python",
        "react",
        "node",
        "html",
        "css",
        "docker",
        "git",
        "agile",
        "excel",
        "microsoft office",
        "project management",
        "communication",
        "leadership",
        "management",
        "teamwork",
        "problem solving",
        "time management",
        "software development",
        "coding",
        "professional experience",
        "work ethic"
      ],
      "experience": {
        "years": 5,
        "roles": [
          "developer"
        ]
      },
      "education": [
        "degree",
        "bachelor"
      ],
      "keywords": [
        "skills",
        "react",
        "javascript",
        "node",
        "problem",
        "solving",
        "communication",
        "management",
        "2020",
        "2025",
        "curriculum",
        "vitae",
        "professional",
        "experience",
        "software",
        "developer",
        "tech",
        "company",
        "developed",
        "web",
        "applications",
        "using",
        "worked",
        "teams",
        "agile",
        "projects",
        "strong",
        "programming",
        "python",
        "html",
        "css",
        "tools",
        "git",
        "docker",
        "code"
      ],
      "desiredRoles": [
        "developer"
      ],
      "summary": "\n      CURRICULUM VITAE\n      \n      PROFESSIONAL EXPERIENCE\n      Software Developer - Tech Company (2020-2025)\n      - Developed web applications using React, JavaScript, and Node.js\n      - Worked with teams on agile projects\n      - Strong problem-solving and communication skills\n      \n      SKILLS\n      Programming: JavaScript, Python, React, Node.js, HTML, CSS\n      Tools: Git, Docker, VS Code\n      Soft Skills: Communication, Leadership, Teamwork, Project Management\n      \n      EDUCATION\n      Bachelor's Degree in Computer Science\n      \n      Additional Skills: Microsoft Office, Excel, Problem Solving, Time Management\n    "
    },
    "statistics": {
      "totalApplications": 0,
      "pendingApplications": 0,
      "successfulApplications": 0,
      "failedApplications": 0,
      "startDate": "2025-11-08T20:11:41.438Z"
    },
    "createdAt": "2025-11-08T20:11:41.439Z"
  },
  {
    "id": "auto-apply-1762632709077-5vo5jlpl9",
    "userId": "guest",
    "status": "active",
    "preferences": {
      "minMatchScore": 40,
      "locations": [],
      "jobTypes": [
        "full-time",
        "part-time",
        "temporary",
        "contract"
      ],
      "excludeCompanies": [],
      "maxApplicationsPerDay": 10,
      "autoWithdrawAfterDays": null
    },
    "cvData": {
      "fileName": "Maanda_Netshisumbewa_CV_.pdf",
      "uploadDate": "2025-11-08T20:11:48.163Z",
      "skills": [
        "javascript",
        "js",
        "python",
        "react",
        "node",
        "html",
        "css",
        "docker",
        "git",
        "agile",
        "excel",
        "microsoft office",
        "project management",
        "communication",
        "leadership",
        "management",
        "teamwork",
        "problem solving",
        "time management",
        "software development",
        "coding",
        "professional experience",
        "work ethic"
      ],
      "experience": {
        "years": 5,
        "roles": [
          "developer"
        ]
      },
      "education": [
        "degree",
        "bachelor"
      ],
      "keywords": [
        "skills",
        "react",
        "javascript",
        "node",
        "problem",
        "solving",
        "communication",
        "management",
        "2020",
        "2025",
        "curriculum",
        "vitae",
        "professional",
        "experience",
        "software",
        "developer",
        "tech",
        "company",
        "developed",
        "web",
        "applications",
        "using",
        "worked",
        "teams",
        "agile",
        "projects",
        "strong",
        "programming",
        "python",
        "html",
        "css",
        "tools",
        "git",
        "docker",
        "code"
      ],
      "desiredRoles": [
        "developer"
      ],
      "summary": "\n      CURRICULUM VITAE\n      \n      PROFESSIONAL EXPERIENCE\n      Software Developer - Tech Company (2020-2025)\n      - Developed web applications using React, JavaScript, and Node.js\n      - Worked with teams on agile projects\n      - Strong problem-solving and communication skills\n      \n      SKILLS\n      Programming: JavaScript, Python, React, Node.js, HTML, CSS\n      Tools: Git, Docker, VS Code\n      Soft Skills: Communication, Leadership, Teamwork, Project Management\n      \n      EDUCATION\n      Bachelor's Degree in Computer Science\n      \n      Additional Skills: Microsoft Office, Excel, Problem Solving, Time Management\n    "
    },
    "statistics": {
      "totalApplications": 0,
      "pendingApplications": 0,
      "successfulApplications": 0,
      "failedApplications": 0,
      "startDate": "2025-11-08T20:11:49.077Z"
    },
    "createdAt": "2025-11-08T20:11:49.077Z"
  },
  {
    "id": "auto-apply-1762632713922-1yqirshya",
    "userId": "guest",
    "status": "active",
    "preferences": {
      "minMatchScore": 40,
      "locations": [],
      "jobTypes": [
        "full-time",
        "part-time",
        "temporary",
        "contract"
      ],
      "excludeCompanies": [],
      "maxApplicationsPerDay": 10,
      "autoWithdrawAfterDays": null
    },
    "cvData": {
      "fileName": "Maanda_Netshisumbewa_CV_.pdf",
      "uploadDate": "2025-11-08T20:11:48.163Z",
      "skills": [
        "javascript",
        "js",
        "python",
        "react",
        "node",
        "html",
        "css",
        "docker",
        "git",
        "agile",
        "excel",
        "microsoft office",
        "project management",
        "communication",
        "leadership",
        "management",
        "teamwork",
        "problem solving",
        "time management",
        "software development",
        "coding",
        "professional experience",
        "work ethic"
      ],
      "experience": {
        "years": 5,
        "roles": [
          "developer"
        ]
      },
      "education": [
        "degree",
        "bachelor"
      ],
      "keywords": [
        "skills",
        "react",
        "javascript",
        "node",
        "problem",
        "solving",
        "communication",
        "management",
        "2020",
        "2025",
        "curriculum",
        "vitae",
        "professional",
        "experience",
        "software",
        "developer",
        "tech",
        "company",
        "developed",
        "web",
        "applications",
        "using",
        "worked",
        "teams",
        "agile",
        "projects",
        "strong",
        "programming",
        "python",
        "html",
        "css",
        "tools",
        "git",
        "docker",
        "code"
      ],
      "desiredRoles": [
        "developer"
      ],
      "summary": "\n      CURRICULUM VITAE\n      \n      PROFESSIONAL EXPERIENCE\n      Software Developer - Tech Company (2020-2025)\n      - Developed web applications using React, JavaScript, and Node.js\n      - Worked with teams on agile projects\n      - Strong problem-solving and communication skills\n      \n      SKILLS\n      Programming: JavaScript, Python, React, Node.js, HTML, CSS\n      Tools: Git, Docker, VS Code\n      Soft Skills: Communication, Leadership, Teamwork, Project Management\n      \n      EDUCATION\n      Bachelor's Degree in Computer Science\n      \n      Additional Skills: Microsoft Office, Excel, Problem Solving, Time Management\n    "
    },
    "statistics": {
      "totalApplications": 0,
      "pendingApplications": 0,
      "successfulApplications": 0,
      "failedApplications": 0,
      "startDate": "2025-11-08T20:11:53.922Z"
    },
    "createdAt": "2025-11-08T20:11:53.922Z"
  },
  {
    "id": "auto-apply-1762632719874-lmvlgey8q",
    "userId": "guest",
    "status": "active",
    "preferences": {
      "minMatchScore": 92,
      "locations": [],
      "jobTypes": [
        "full-time",
        "part-time",
        "temporary",
        "contract"
      ],
      "excludeCompanies": [],
      "maxApplicationsPerDay": 10,
      "autoWithdrawAfterDays": null
    },
    "cvData": {
      "fileName": "Maanda_Netshisumbewa_CV_.pdf",
      "uploadDate": "2025-11-08T20:11:48.163Z",
      "skills": [
        "javascript",
        "js",
        "python",
        "react",
        "node",
        "html",
        "css",
        "docker",
        "git",
        "agile",
        "excel",
        "microsoft office",
        "project management",
        "communication",
        "leadership",
        "management",
        "teamwork",
        "problem solving",
        "time management",
        "software development",
        "coding",
        "professional experience",
        "work ethic"
      ],
      "experience": {
        "years": 5,
        "roles": [
          "developer"
        ]
      },
      "education": [
        "degree",
        "bachelor"
      ],
      "keywords": [
        "skills",
        "react",
        "javascript",
        "node",
        "problem",
        "solving",
        "communication",
        "management",
        "2020",
        "2025",
        "curriculum",
        "vitae",
        "professional",
        "experience",
        "software",
        "developer",
        "tech",
        "company",
        "developed",
        "web",
        "applications",
        "using",
        "worked",
        "teams",
        "agile",
        "projects",
        "strong",
        "programming",
        "python",
        "html",
        "css",
        "tools",
        "git",
        "docker",
        "code"
      ],
      "desiredRoles": [
        "developer"
      ],
      "summary": "\n      CURRICULUM VITAE\n      \n      PROFESSIONAL EXPERIENCE\n      Software Developer - Tech Company (2020-2025)\n      - Developed web applications using React, JavaScript, and Node.js\n      - Worked with teams on agile projects\n      - Strong problem-solving and communication skills\n      \n      SKILLS\n      Programming: JavaScript, Python, React, Node.js, HTML, CSS\n      Tools: Git, Docker, VS Code\n      Soft Skills: Communication, Leadership, Teamwork, Project Management\n      \n      EDUCATION\n      Bachelor's Degree in Computer Science\n      \n      Additional Skills: Microsoft Office, Excel, Problem Solving, Time Management\n    "
    },
    "statistics": {
      "totalApplications": 0,
      "pendingApplications": 0,
      "successfulApplications": 0,
      "failedApplications": 0,
      "startDate": "2025-11-08T20:11:59.874Z"
    },
    "createdAt": "2025-11-08T20:11:59.874Z"
  }
]